{
  "$schema": "https://json-schema.org/draft/2020-12/schema",
  "title": "Transpera process file (transpera-process/2)",
  "description": "A process for Transpera Flow, with the evidence behind it. Only the fields marked required have to be there; anything left out is filled in and marked to confirm on the canvas. Nothing company-wide is applied: the upload adds the process (as a draft), its sources and its first principles, and never changes people, clients, services or demand.",
  "type": "object",
  "required": [
    "format",
    "name",
    "steps"
  ],
  "$defs": {
    "citation": {
      "type": "object",
      "required": [
        "source",
        "quote"
      ],
      "description": "One quote that backs a value.",
      "properties": {
        "source": {
          "type": "string",
          "minLength": 1,
          "description": "The id of one of the file's sources."
        },
        "quote": {
          "type": "string",
          "minLength": 1,
          "maxLength": 2000,
          "description": "The words said, verbatim. Quote just the sentence that gives the number."
        },
        "speaker": {
          "type": "string",
          "maxLength": 200,
          "description": "Who said it."
        },
        "time": {
          "type": "string",
          "maxLength": 100,
          "description": "Where in the source: a time in the recording (00:14:05), a page, a cell."
        },
        "value": {
          "type": "number",
          "minimum": 0,
          "description": "The number they stated, in the units of the value it backs (hours; 0 to 1 for a share). Different values for one number are a conflict, shown for you to settle."
        }
      }
    }
  },
  "properties": {
    "format": {
      "const": "transpera-process/2",
      "description": "Always the text transpera-process/2."
    },
    "name": {
      "type": "string",
      "minLength": 1,
      "maxLength": 120,
      "description": "What the process is called, e.g. Enquiry to signed client."
    },
    "kind": {
      "enum": [
        "pipeline",
        "servicing"
      ],
      "default": "pipeline",
      "description": "pipeline: how new leads become clients (default). servicing: a recurring process for existing clients."
    },
    "description": {
      "type": "string",
      "maxLength": 4000,
      "description": "A sentence on what the process covers."
    },
    "entity_name": {
      "type": "string",
      "minLength": 1,
      "maxLength": 100,
      "description": "What flows through it, e.g. lead, task. Default: lead for a pipeline, item for a servicing process."
    },
    "sources": {
      "type": "array",
      "maxItems": 50,
      "description": "The materials the file is built from. They are added to Sources and linked to this process. Evidence points at them by id.",
      "items": {
        "type": "object",
        "required": [
          "id",
          "title"
        ],
        "properties": {
          "id": {
            "type": "string",
            "minLength": 1,
            "maxLength": 64,
            "description": "A short unique id, e.g. interview-maya. Evidence uses it."
          },
          "title": {
            "type": "string",
            "minLength": 1,
            "maxLength": 200,
            "description": "e.g. Interview with Maya Chen, 30 Sep."
          },
          "kind": {
            "enum": [
              "transcript",
              "notes",
              "sop",
              "spreadsheet",
              "data",
              "screenshot",
              "other"
            ],
            "default": "transcript",
            "description": "transcript (a conversation), sop (a written procedure), spreadsheet, data (an export), notes (any other document, or a drawn map), screenshot or other."
          },
          "date": {
            "type": "string",
            "pattern": "^\\d{4}-\\d{2}-\\d{2}$",
            "description": "The day it is from, like 2026-09-30."
          },
          "speakers": {
            "type": "array",
            "items": {
              "type": "string"
            },
            "description": "Who spoke or wrote it."
          },
          "body": {
            "type": "string",
            "maxLength": 500000,
            "description": "The text itself (optional; leave it out for a long one). When given, quotes are checked against it."
          }
        }
      }
    },
    "steps": {
      "type": "array",
      "minItems": 1,
      "maxItems": 200,
      "description": "Every step. Give each a short unique id that links refer to. Leave out any number nobody gave you: it is marked as missing, and never invented.",
      "items": {
        "type": "object",
        "required": [
          "id",
          "name"
        ],
        "properties": {
          "id": {
            "type": "string",
            "minLength": 1,
            "description": "A short unique id, e.g. review. Links use it."
          },
          "name": {
            "type": "string",
            "minLength": 1,
            "maxLength": 120,
            "description": "What the step is called on the map."
          },
          "type": {
            "enum": [
              "step",
              "decision",
              "wait",
              "start",
              "end"
            ],
            "default": "step",
            "description": "step: someone does work. decision: items branch. wait: items sit and wait. start and end: where items come in and finish."
          },
          "role": {
            "type": "string",
            "description": "The role that does it, e.g. Managing director. Roles the company doesn't have yet are matched in the preview; none are created."
          },
          "person": {
            "type": "string",
            "description": "A person to pin it to (only if they are already in the company; otherwise ignored)."
          },
          "hands_on_hours": {
            "type": "number",
            "minimum": 0,
            "maximum": 10000,
            "description": "Hours of hands-on work per item (average)."
          },
          "wait_hours": {
            "type": "number",
            "minimum": 0,
            "maximum": 100000,
            "description": "Hours an item waits at this step per item (average)."
          },
          "rework_rate": {
            "type": "number",
            "minimum": 0,
            "maximum": 1,
            "description": "Share of items sent back to do again, from 0 to 1 (0.1 is one in ten)."
          },
          "notes": {
            "type": "string",
            "maxLength": 4000
          },
          "x": {
            "type": "number",
            "description": "Position on the map. Give x and y together, or leave both out to be laid out left to right."
          },
          "y": {
            "type": "number"
          },
          "hands_on_range": {
            "type": "object",
            "required": [
              "min",
              "max"
            ],
            "properties": {
              "min": {
                "type": "number",
                "minimum": 0
              },
              "max": {
                "type": "number",
                "minimum": 0
              }
            },
            "description": "The lowest and highest hands-on time in hours. The typical value is the number beside it."
          },
          "wait_range": {
            "type": "object",
            "required": [
              "min",
              "max"
            ],
            "properties": {
              "min": {
                "type": "number",
                "minimum": 0
              },
              "max": {
                "type": "number",
                "minimum": 0
              }
            },
            "description": "The lowest and highest wait in hours. The typical value is the number beside it."
          },
          "rework_to": {
            "type": "string",
            "description": "The id of the step rework goes back to. Default: this step."
          },
          "tool": {
            "type": "string",
            "maxLength": 200,
            "description": "The tool used, e.g. HubSpot."
          },
          "sla_hours": {
            "type": "number",
            "minimum": 0,
            "maximum": 10000,
            "description": "Target hours for one visit to the step."
          },
          "waiting_now": {
            "type": "integer",
            "minimum": 0,
            "description": "Items sitting at the step right now."
          },
          "split": {
            "type": "object",
            "required": [
              "automatable",
              "augmentable",
              "manual"
            ],
            "description": "How the step's hands-on time divides: automatable (gathering and collating: pulling numbers, drafting from data), augmentable (judging: a tool can help but a person decides) and manual (checking, deciding, the client call). Shares from 0 to 1 that add up to 1. Only when the sources say how the work divides.",
            "properties": {
              "automatable": {
                "type": "number",
                "minimum": 0,
                "maximum": 1
              },
              "augmentable": {
                "type": "number",
                "minimum": 0,
                "maximum": 1
              },
              "manual": {
                "type": "number",
                "minimum": 0,
                "maximum": 1
              }
            }
          },
          "split_notes": {
            "type": "object",
            "description": "One line of words on what each part of the split is, e.g. \"Pull spend and budgets, spot under-pacing\".",
            "properties": {
              "automatable": {
                "type": "string",
                "maxLength": 300
              },
              "augmentable": {
                "type": "string",
                "maxLength": 300
              },
              "manual": {
                "type": "string",
                "maxLength": 300
              }
            }
          },
          "tier_multiplier": {
            "type": "object",
            "description": "× on the step's time for a client of each tier, by tier name, e.g. {\"T1\": 1.3, \"T2\": 1, \"T3\": 0.8}. A tier not listed is 1. Only when the sources say a tier takes longer or shorter.",
            "additionalProperties": {
              "type": "number",
              "minimum": 0,
              "maximum": 100
            }
          },
          "to_client_manager": {
            "type": "boolean",
            "description": "True when the step is done by the client's own manager, whatever their role. Keep the role as the fallback."
          },
          "sources": {
            "type": "object",
            "description": "Where a value came from, by value (work, split, tier_multiplier): interview, calculator, measured, estimate.",
            "properties": {
              "work": {
                "enum": [
                  "interview",
                  "calculator",
                  "measured",
                  "estimate"
                ]
              },
              "split": {
                "enum": [
                  "interview",
                  "calculator",
                  "measured",
                  "estimate"
                ]
              },
              "tier_multiplier": {
                "enum": [
                  "interview",
                  "calculator",
                  "measured",
                  "estimate"
                ]
              }
            }
          },
          "evidence": {
            "type": "object",
            "description": "Quotes by value: hands_on_hours, wait_hours, rework_rate, waiting_now, sla_hours. Every number that came from a source should have its quote.",
            "properties": {
              "hands_on_hours": {
                "type": "array",
                "maxItems": 10,
                "items": {
                  "$ref": "#/$defs/citation"
                }
              },
              "wait_hours": {
                "type": "array",
                "maxItems": 10,
                "items": {
                  "$ref": "#/$defs/citation"
                }
              },
              "rework_rate": {
                "type": "array",
                "maxItems": 10,
                "items": {
                  "$ref": "#/$defs/citation"
                }
              },
              "waiting_now": {
                "type": "array",
                "maxItems": 10,
                "items": {
                  "$ref": "#/$defs/citation"
                }
              },
              "sla_hours": {
                "type": "array",
                "maxItems": 10,
                "items": {
                  "$ref": "#/$defs/citation"
                }
              }
            }
          },
          "assumed": {
            "type": "object",
            "description": "Why a value is an assumption, by value: hands_on_hours, wait_hours, rework_rate, waiting_now, sla_hours.",
            "properties": {
              "hands_on_hours": {
                "type": "string",
                "minLength": 1,
                "maxLength": 2000,
                "description": "Why the value is an assumption: nobody said it, so say where the guess comes from (\"Typical for a proposal; Sam confirmed the order of magnitude\")."
              },
              "wait_hours": {
                "type": "string",
                "minLength": 1,
                "maxLength": 2000,
                "description": "Why the value is an assumption: nobody said it, so say where the guess comes from (\"Typical for a proposal; Sam confirmed the order of magnitude\")."
              },
              "rework_rate": {
                "type": "string",
                "minLength": 1,
                "maxLength": 2000,
                "description": "Why the value is an assumption: nobody said it, so say where the guess comes from (\"Typical for a proposal; Sam confirmed the order of magnitude\")."
              },
              "waiting_now": {
                "type": "string",
                "minLength": 1,
                "maxLength": 2000,
                "description": "Why the value is an assumption: nobody said it, so say where the guess comes from (\"Typical for a proposal; Sam confirmed the order of magnitude\")."
              },
              "sla_hours": {
                "type": "string",
                "minLength": 1,
                "maxLength": 2000,
                "description": "Why the value is an assumption: nobody said it, so say where the guess comes from (\"Typical for a proposal; Sam confirmed the order of magnitude\")."
              }
            }
          }
        }
      }
    },
    "links": {
      "type": "array",
      "maxItems": 500,
      "description": "How the steps connect, each from one step id to another.",
      "items": {
        "type": "object",
        "required": [
          "from",
          "to"
        ],
        "properties": {
          "from": {
            "type": "string",
            "minLength": 1
          },
          "to": {
            "type": "string",
            "minLength": 1
          },
          "probability": {
            "type": "number",
            "minimum": 0,
            "maximum": 1,
            "description": "The share of items that take this branch, from 0 to 1. Branches out of a step add up to 1."
          },
          "label": {
            "type": "string",
            "maxLength": 200,
            "description": "e.g. Qualified"
          },
          "evidence": {
            "type": "array",
            "maxItems": 10,
            "items": {
              "$ref": "#/$defs/citation"
            },
            "description": "Quotes that back this, word for word, each from one of the file's sources."
          },
          "assumed": {
            "type": "string",
            "minLength": 1,
            "maxLength": 2000,
            "description": "Why the value is an assumption: nobody said it, so say where the guess comes from (\"Typical for a proposal; Sam confirmed the order of magnitude\")."
          }
        }
      }
    },
    "groups": {
      "type": "array",
      "description": "Optional boxes that gather steps on the map.",
      "items": {
        "type": "object",
        "required": [
          "name",
          "steps"
        ],
        "properties": {
          "name": {
            "type": "string",
            "minLength": 1,
            "maxLength": 120
          },
          "steps": {
            "type": "array",
            "items": {
              "type": "string"
            },
            "description": "Ids of the steps in the group (not start or end steps)."
          }
        }
      }
    }
  }
}
